{
  "contract_version": "1",
  "manifest_id": "manifest_echo_00000001",
  "request": {
    "contract_version": "1",
    "request_id": "req_echo_00000001",
    "capability": {
      "name": "example.echo",
      "schema_version": "1"
    },
    "target": {
      "kind": "example",
      "reference": "urn:dubnium:example:target:echo"
    },
    "payload": {
      "message": "Hello, Dubnium!",
      "repeat": 2,
      "max_output_bytes": 64
    },
    "evidence": [
      {
        "kind": "synthetic-ci",
        "reference": "urn:dubnium:example:evidence:ci-0001",
        "digest": "sha256:1111111111111111111111111111111111111111111111111111111111111111"
      }
    ],
    "requested_at": "2026-08-05T20:00:00Z",
    "expires_at": "2026-08-05T20:10:00Z"
  },
  "request_digest": "sha256:d0362b0bb4a778b4bec3486ae00eacb186027a01f1ad33a0db8f4a74627ed2dd",
  "actor": {
    "reference": "urn:dubnium:actor:synthetic-loopback",
    "authentication_method": "loopback-profile"
  },
  "authorization": {
    "decision_ref": "urn:anthesis:decision:synthetic-allow-0001",
    "policy_ref": "urn:anthesis:policy:synthetic-example-echo-v1",
    "outcome": "allow",
    "granted_constraints": {
      "max_output_bytes": 48
    },
    "approval_refs": [],
    "evidence_requirements": {
      "before_execution": [],
      "completion": []
    },
    "expires_at": "2026-08-05T20:09:00Z"
  },
  "issued_at": "2026-08-05T20:00:01Z"
}
